[
  {
    "id": "ikea-demo-001",
    "brand": "IKEA",
    "productName": "Demo Sofa Nordic",
    "collection": "Nordic Living",
    "category": "sofa",
    "subcategory": "3-seat-sofa",
    "sku": "IKEA-DEMO-001",
    "externalSku": "",
    "productUrl": "https://www.ikea.com/es/es/p/demo-sofa-nordic",
    "sourceUrl": "",
    "modelPath": "assets/_placeholder/demo-model.glb",
    "previewPath": "previews/_placeholder/demo-preview.svg",
    "format": "glb",
    "fileSizeMb": 2.4,
    "polygonCount": 12400,
    "textureCount": 3,
    "dimensions": { "width": 220, "height": 85, "depth": 95, "unit": "cm" },
    "color": "Light Grey",
    "material": "Fabric / Oak legs",
    "styleTags": ["scandinavian", "minimalist", "nordic"],
    "roomTags": ["living-room", "lounge"],
    "useCases": ["staging", "render", "tour"],
    "licenseType": "authorized-commercial-demo",
    "commercialUseAllowed": true,
    "redistributionAllowed": false,
    "resaleAllowed": false,
    "brandUsageAllowed": true,
    "attributionRequired": true,
    "permissionDocumentRef": "docs/placeholder-permission-ikea.pdf",
    "permissionScope": "spain",
    "capturedAt": "2026-06-01T10:00:00Z",
    "qaStatus": "pending",
    "qaNotes": "Pending real model upload",
    "notes": "Demo placeholder. Replace with real asset when authorized."
  },
  {
    "id": "ikea-demo-002",
    "brand": "IKEA",
    "productName": "Demo Armchair Berg",
    "collection": "Nordic Living",
    "category": "armchair",
    "subcategory": "wing-chair",
    "sku": "IKEA-DEMO-002",
    "modelPath": "assets/_placeholder/demo-model.glb",
    "previewPath": "previews/_placeholder/demo-preview.svg",
    "format": "glb",
    "fileSizeMb": 1.8,
    "dimensions": { "width": 82, "height": 101, "depth": 85, "unit": "cm" },
    "color": "Dark Green",
    "material": "Velvet / Birch legs",
    "styleTags": ["scandinavian", "vintage"],
    "roomTags": ["living-room", "bedroom"],
    "useCases": ["staging", "render"],
    "licenseType": "authorized-commercial-demo",
    "commercialUseAllowed": true,
    "redistributionAllowed": false,
    "resaleAllowed": false,
    "brandUsageAllowed": true,
    "qaStatus": "pending",
    "notes": "Demo placeholder"
  },
  {
    "id": "ikea-demo-003",
    "brand": "IKEA",
    "productName": "Demo Coffee Table Laxe",
    "collection": "Nordic Living",
    "category": "coffee-table",
    "subcategory": "round",
    "sku": "IKEA-DEMO-003",
    "modelPath": "assets/_placeholder/demo-model.glb",
    "previewPath": "previews/_placeholder/demo-preview.svg",
    "format": "glb",
    "fileSizeMb": 0.9,
    "dimensions": { "width": 90, "height": 45, "depth": 90, "unit": "cm" },
    "color": "Oak Veneer",
    "material": "Oak veneer / Steel",
    "styleTags": ["scandinavian", "minimalist"],
    "roomTags": ["living-room"],
    "useCases": ["staging", "render", "tour"],
    "licenseType": "authorized-commercial-demo",
    "commercialUseAllowed": true,
    "redistributionAllowed": false,
    "resaleAllowed": false,
    "brandUsageAllowed": true,
    "qaStatus": "pending"
  },
  {
    "id": "ikea-demo-004",
    "brand": "IKEA",
    "productName": "Demo Dining Table Mora",
    "collection": "Kitchen Essentials",
    "category": "dining-table",
    "subcategory": "extendable",
    "sku": "IKEA-DEMO-004",
    "modelPath": "assets/_placeholder/demo-model.glb",
    "previewPath": "previews/_placeholder/demo-preview.svg",
    "format": "glb",
    "fileSizeMb": 1.5,
    "dimensions": { "width": 180, "height": 75, "depth": 90, "unit": "cm" },
    "color": "White / Oak",
    "material": "MDF / Oak veneer",
    "styleTags": ["minimalist", "modern"],
    "roomTags": ["dining-room", "kitchen"],
    "useCases": ["staging", "render"],
    "licenseType": "authorized-commercial-demo",
    "commercialUseAllowed": true,
    "redistributionAllowed": false,
    "resaleAllowed": false,
    "brandUsageAllowed": true,
    "qaStatus": "pending"
  },
  {
    "id": "ikea-demo-005",
    "brand": "IKEA",
    "productName": "Demo Chair Edda",
    "collection": "Kitchen Essentials",
    "category": "chair",
    "subcategory": "dining-chair",
    "sku": "IKEA-DEMO-005",
    "modelPath": "assets/_placeholder/demo-model.glb",
    "previewPath": "previews/_placeholder/demo-preview.svg",
    "format": "glb",
    "fileSizeMb": 0.7,
    "dimensions": { "width": 47, "height": 80, "depth": 50, "unit": "cm" },
    "color": "Black",
    "material": "Polypropylene / Steel",
    "styleTags": ["modern", "industrial"],
    "roomTags": ["dining-room", "kitchen", "office"],
    "useCases": ["staging", "render", "tour"],
    "licenseType": "authorized-commercial-demo",
    "commercialUseAllowed": true,
    "redistributionAllowed": false,
    "resaleAllowed": false,
    "brandUsageAllowed": true,
    "qaStatus": "pending"
  },
  {
    "id": "ikea-demo-006",
    "brand": "IKEA",
    "productName": "Demo Bed Malm",
    "collection": "Bedroom Basics",
    "category": "bed",
    "subcategory": "double-bed",
    "sku": "IKEA-DEMO-006",
    "modelPath": "assets/_placeholder/demo-model.glb",
    "previewPath": "previews/_placeholder/demo-preview.svg",
    "format": "glb",
    "fileSizeMb": 3.2,
    "dimensions": { "width": 180, "height": 100, "depth": 200, "unit": "cm" },
    "color": "White Stained Oak",
    "material": "Particleboard / Oak foil",
    "styleTags": ["minimalist", "scandinavian"],
    "roomTags": ["bedroom"],
    "useCases": ["staging", "render"],
    "licenseType": "authorized-commercial-demo",
    "commercialUseAllowed": true,
    "redistributionAllowed": false,
    "resaleAllowed": false,
    "brandUsageAllowed": true,
    "qaStatus": "pending"
  },
  {
    "id": "ikea-demo-007",
    "brand": "IKEA",
    "productName": "Demo Wardrobe Pax",
    "collection": "Bedroom Basics",
    "category": "wardrobe",
    "subcategory": "sliding-door",
    "sku": "IKEA-DEMO-007",
    "modelPath": "assets/_placeholder/demo-model.glb",
    "previewPath": "previews/_placeholder/demo-preview.svg",
    "format": "glb",
    "fileSizeMb": 4.1,
    "dimensions": { "width": 200, "height": 236, "depth": 60, "unit": "cm" },
    "color": "White",
    "material": "Particleboard / Foil",
    "styleTags": ["minimalist", "functional"],
    "roomTags": ["bedroom"],
    "useCases": ["staging", "render"],
    "licenseType": "authorized-commercial-demo",
    "commercialUseAllowed": true,
    "redistributionAllowed": false,
    "resaleAllowed": false,
    "brandUsageAllowed": true,
    "qaStatus": "pending"
  },
  {
    "id": "ikea-demo-008",
    "brand": "IKEA",
    "productName": "Demo Floor Lamp Ranarp",
    "collection": "Lighting Collection",
    "category": "lamp",
    "subcategory": "floor-lamp",
    "sku": "IKEA-DEMO-008",
    "modelPath": "assets/_placeholder/demo-model.glb",
    "previewPath": "previews/_placeholder/demo-preview.svg",
    "format": "glb",
    "fileSizeMb": 0.6,
    "dimensions": { "width": 28, "height": 150, "depth": 28, "unit": "cm" },
    "color": "Black / Brass",
    "material": "Steel / Brass",
    "styleTags": ["industrial", "vintage"],
    "roomTags": ["living-room", "bedroom", "office"],
    "useCases": ["staging", "render", "tour"],
    "licenseType": "authorized-commercial-demo",
    "commercialUseAllowed": true,
    "redistributionAllowed": false,
    "resaleAllowed": false,
    "brandUsageAllowed": true,
    "qaStatus": "pending"
  },
  {
    "id": "ikea-demo-009",
    "brand": "IKEA",
    "productName": "Demo Rug Silkeborg",
    "collection": "Textile Collection",
    "category": "rug",
    "subcategory": "flatwoven",
    "sku": "IKEA-DEMO-009",
    "modelPath": "assets/_placeholder/demo-model.glb",
    "previewPath": "previews/_placeholder/demo-preview.svg",
    "format": "glb",
    "fileSizeMb": 1.2,
    "dimensions": { "width": 170, "height": 1, "depth": 240, "unit": "cm" },
    "color": "Natural / Black",
    "material": "Jute / Cotton",
    "styleTags": ["bohemian", "natural"],
    "roomTags": ["living-room", "bedroom"],
    "useCases": ["staging", "render"],
    "licenseType": "authorized-commercial-demo",
    "commercialUseAllowed": true,
    "redistributionAllowed": false,
    "resaleAllowed": false,
    "brandUsageAllowed": true,
    "qaStatus": "pending"
  },
  {
    "id": "ikea-demo-010",
    "brand": "IKEA",
    "productName": "Demo Vase Svalka",
    "collection": "Decor Essentials",
    "category": "decor",
    "subcategory": "vase",
    "sku": "IKEA-DEMO-010",
    "modelPath": "assets/_placeholder/demo-model.glb",
    "previewPath": "previews/_placeholder/demo-preview.svg",
    "format": "glb",
    "fileSizeMb": 0.3,
    "dimensions": { "width": 15, "height": 30, "depth": 15, "unit": "cm" },
    "color": "Clear Glass",
    "material": "Glass",
    "styleTags": ["minimalist", "modern"],
    "roomTags": ["living-room", "bedroom", "dining-room"],
    "useCases": ["staging", "render", "tour"],
    "licenseType": "authorized-commercial-demo",
    "commercialUseAllowed": true,
    "redistributionAllowed": false,
    "resaleAllowed": false,
    "brandUsageAllowed": true,
    "qaStatus": "pending"
  },
  {
    "id": "ikea-demo-011",
    "brand": "IKEA",
    "productName": "Demo Shelf Billy",
    "collection": "Storage Solutions",
    "category": "shelf",
    "subcategory": "bookcase",
    "sku": "IKEA-DEMO-011",
    "modelPath": "assets/_placeholder/demo-model.glb",
    "previewPath": "previews/_placeholder/demo-preview.svg",
    "format": "glb",
    "fileSizeMb": 1.1,
    "dimensions": { "width": 80, "height": 202, "depth": 28, "unit": "cm" },
    "color": "White",
    "material": "Particleboard / Foil",
    "styleTags": ["minimalist", "functional"],
    "roomTags": ["living-room", "office", "bedroom"],
    "useCases": ["staging", "render"],
    "licenseType": "authorized-commercial-demo",
    "commercialUseAllowed": true,
    "redistributionAllowed": false,
    "resaleAllowed": false,
    "brandUsageAllowed": true,
    "qaStatus": "pending"
  },
  {
    "id": "ikea-demo-012",